{
  "bundle_manifest_id": "abm_2v7pr9wx4qk1m3snbd6thzey8c",
  "manifest_version": 1,
  "provenance": {
    "tenant_id": "tenant_public",
    "corpus_id": "corpus_public_ch_fedlex_constitution",
    "scope_type": "global_public",
    "source_id": "src_9dqzk4mtv7rn2xewb3hy6spa1c",
    "source_version_id": "sv_7htyq2vmc4br9xkn8zwde5fp3s",
    "run_id": "run_01kxe7gbdd9st8m6k9vvh46n49",
    "source_snapshot_id": "snap_3kqm7wvz9r2ne5td8bhx1yfa4g",
    "bundle_manifest_id": "abm_2v7pr9wx4qk1m3snbd6thzey8c"
  },
  "source_snapshot_id": "snap_3kqm7wvz9r2ne5td8bhx1yfa4g",
  "source_origin_kind": "official_primary",
  "trust_tier": "authoritative",
  "snapshot_captured_at": "2026-03-29T09:30:00Z",
  "source_defaults": {
    "jurisdiction_id": "jur_ch_federal",
    "authority_id": "auth_fedlex",
    "language_codes": ["de"],
    "document_type_hint": "legislation"
  },
  "parser_hints": {
    "expected_modalities": ["html"],
    "expected_content_types": ["text/html"],
    "preferred_primary_artifact_roles": ["primary_document"],
    "ocr_expected": false,
    "attachment_policy": "ignore"
  },
  "di_overrides": {},
  "reference_context": {
    "reference_snapshot_policy": "latest_approved",
    "reference_snapshot_set_ref": null
  },
  "artifacts": [
    {
      "artifact_id": "art_6nwbk8xzq3rt5vmc1yhd7pje2f",
      "artifact_role": "primary_document",
      "storage_ref": {
        "uri": "file://__ARTIFACT_PATH__",
        "content_type": "text/html",
        "byte_size": "__ARTIFACT_SIZE__",
        "checksum": "__ARTIFACT_CHECKSUM__",
        "checksum_algorithm": "sha256",
        "created_at": "2026-03-29T09:30:04Z"
      }
    }
  ],
  "bundle_metadata": {}
}
