{
  "bundle_manifest_id": "abm_5kqhdrcka34ykyng7rew7cbgqs",
  "manifest_version": 1,
  "provenance": {
    "tenant_id": "tenant_public",
    "corpus_id": "corpus_public_ch_fedlex_constitution",
    "scope_type": "global_public",
    "source_id": "src_s5jrtxrfrrr16ynwjm2p6mhkkt",
    "source_version_id": "sv_54fzg157tp62j6fahmn4skqsf0",
    "run_id": "run_e5kck8ng5brv64m5r4hrwez0nf",
    "source_snapshot_id": "snap_8bhjbrx3bshme9dhnkd7rze7h8",
    "bundle_manifest_id": "abm_5kqhdrcka34ykyng7rew7cbgqs"
  },
  "source_snapshot_id": "snap_8bhjbrx3bshme9dhnkd7rze7h8",
  "source_origin_kind": "official_primary",
  "trust_tier": "authoritative",
  "snapshot_captured_at": "2026-03-29T09:30:00Z",
  "source_defaults": {
    "jurisdiction_id": "jur_ch_federal",
    "authority_id": "auth_fedlex",
    "language_codes": ["de"],
    "document_type_hint": "legislation"
  },
  "parser_hints": {
    "expected_modalities": ["html"],
    "expected_content_types": ["text/html"],
    "preferred_primary_artifact_roles": ["primary_document"],
    "ocr_expected": false,
    "attachment_policy": "ignore"
  },
  "di_overrides": {},
  "reference_context": {
    "reference_snapshot_policy": "latest_approved",
    "reference_snapshot_set_ref": null
  },
  "artifacts": [
    {
      "artifact_id": "art_4vdjezxk34ns14n2m15kr517bp",
      "artifact_role": "primary_document",
      "storage_ref": {
        "uri": "file://__ARTIFACT_PATH__",
        "content_type": "text/html",
        "byte_size": "__ARTIFACT_SIZE__",
        "checksum": "__ARTIFACT_CHECKSUM__",
        "checksum_algorithm": "sha256",
        "created_at": "2026-03-29T09:30:04Z"
      }
    }
  ],
  "bundle_metadata": {}
}
