{
  "bundle_manifest_id": "abm_01jq7ab8x4nm7m3qz3b8e9q2fk",
  "manifest_version": 1,
  "provenance": {
    "tenant_id": "tenant_public",
    "corpus_id": "corpus_public_ch_federal_law",
    "scope_type": "global_public",
    "source_id": "src_01jq79xv3wdd6yr8q5bn0m3zfk",
    "source_version_id": "sv_01jq79zcslf4m3m4gm3t5s59xq",
    "run_id": "run_01jq7a3s9b7j4dndd9sgv6pb9d",
    "source_snapshot_id": "snap_01jq7a7n3nbzj6sk7v95p9frz1",
    "bundle_manifest_id": "abm_01jq7ab8x4nm7m3qz3b8e9q2fk"
  },
  "source_snapshot_id": "snap_01jq7a7n3nbzj6sk7v95p9frz1",
  "source_origin_kind": "official_primary",
  "trust_tier": "authoritative",
  "snapshot_captured_at": "2026-03-29T09:30:00Z",
  "source_defaults": {
    "jurisdiction_id": "jur_ch_federal"
  },
  "parser_hints": {
    "expected_modalities": ["html"],
    "expected_content_types": ["text/html"],
    "preferred_primary_artifact_roles": ["primary_document"]
  },
  "reference_context": {
    "reference_snapshot_policy": "latest_approved",
    "reference_snapshot_set_ref": null
  },
  "artifacts": [
    {
      "artifact_id": "art_01jq7af3f8qqc46zc6xvkf9y4x",
      "artifact_role": "primary_document",
      "storage_ref": {
        "uri": "file://__ARTIFACT_PATH__",
        "content_type": "text/html",
        "byte_size": "__ARTIFACT_SIZE__",
        "checksum": "__ARTIFACT_CHECKSUM__",
        "checksum_algorithm": "sha256",
        "created_at": "2026-03-29T09:30:04Z"
      }
    }
  ],
  "di_overrides": {},
  "bundle_metadata": {}
}
